{
  "identifier": "maximum-decision-information-scope.development.v1",
  "schema_version": "maximum-decision-information-manifest.v1",
  "objective": "Acquire and govern the widest practical set of decision-relevant structured, unstructured, current-event, news, positioning, physical-economy, on-chain, and alternative information while preserving point-in-time availability, licensing, provenance, reliability, independence, corrections, and portfolio-impact lineage.",
  "require_complete_scope": true,
  "sources": [
    {
      "identifier": "official-public-authorities",
      "source_name": "UNASSIGNED_OFFICIAL_GLOBAL_AUTHORITIES",
      "role": "official",
      "independence_group": "official-public-authorities",
      "enabled": false,
      "usage_rights_approved": false,
      "storage_and_backup_approved": false,
      "derived_analytics_approved": false,
      "internal_display_approved": false,
      "paper_simulation_approved": false,
      "event_time_supported": false,
      "publication_time_supported": false,
      "availability_time_supported": false,
      "correction_history_supported": false,
      "historical_coverage_supported": false,
      "provenance_complete": false,
      "entity_mapping_supported": false,
      "geographic_mapping_supported": false,
      "reliability_policy_defined": false,
      "manipulation_controls_defined": false,
      "deduplication_supported": false,
      "service_level_defined": false,
      "certification_required": true,
      "certification_identifier": null,
      "domains": [
        "current_events_news",
        "geopolitical_security",
        "government_policy_regulation",
        "central_bank_communications",
        "elections_political_risk",
        "legal_litigation_sanctions",
        "public_health",
        "cybersecurity_incidents",
        "commodity_physical_balances",
        "weather_climate_disasters",
        "energy_grid_power",
        "labor_web_activity",
        "real_estate_activity",
        "patents_technology_innovation"
      ],
      "authoritative_domains": [
        "current_events_news",
        "geopolitical_security",
        "government_policy_regulation",
        "central_bank_communications",
        "elections_political_risk",
        "legal_litigation_sanctions",
        "public_health",
        "cybersecurity_incidents",
        "commodity_physical_balances",
        "weather_climate_disasters",
        "energy_grid_power",
        "labor_web_activity",
        "real_estate_activity",
        "patents_technology_innovation"
      ],
      "credential_environment_variables": [
        "CAPITAL_INTELLIGENCE_OFFICIAL_EVENTS_SOURCE_CONFIG"
      ],
      "limitations": [
        "Implement and certify original government, regulator, central-bank, court, election, health, cyber, weather, and statistical sources rather than relying on summaries."
      ]
    },
    {
      "identifier": "official-sec-edgar",
      "source_name": "SEC EDGAR",
      "role": "official",
      "independence_group": "sec-edgar",
      "enabled": true,
      "usage_rights_approved": true,
      "storage_and_backup_approved": true,
      "derived_analytics_approved": true,
      "internal_display_approved": true,
      "paper_simulation_approved": true,
      "event_time_supported": true,
      "publication_time_supported": true,
      "availability_time_supported": true,
      "correction_history_supported": true,
      "historical_coverage_supported": false,
      "provenance_complete": true,
      "entity_mapping_supported": true,
      "geographic_mapping_supported": false,
      "reliability_policy_defined": true,
      "manipulation_controls_defined": true,
      "deduplication_supported": true,
      "service_level_defined": true,
      "certification_required": false,
      "certification_identifier": null,
      "domains": [
        "filings_corporate_disclosures",
        "management_guidance",
        "insider_institutional_ownership",
        "legal_litigation_sanctions"
      ],
      "authoritative_domains": [
        "filings_corporate_disclosures",
        "management_guidance",
        "insider_institutional_ownership",
        "legal_litigation_sanctions"
      ],
      "credential_environment_variables": [
        "SEC_USER_AGENT"
      ],
      "limitations": [
        "The current adapter covers recent submissions and company facts; older archives and complete ownership forms require expansion."
      ]
    },
    {
      "identifier": "commercial-global-newswire",
      "source_name": "UNASSIGNED_LICENSED_GLOBAL_NEWSWIRE",
      "role": "primary",
      "independence_group": "global-newswire",
      "enabled": false,
      "usage_rights_approved": false,
      "storage_and_backup_approved": false,
      "derived_analytics_approved": false,
      "internal_display_approved": false,
      "paper_simulation_approved": false,
      "event_time_supported": false,
      "publication_time_supported": false,
      "availability_time_supported": false,
      "correction_history_supported": false,
      "historical_coverage_supported": false,
      "provenance_complete": false,
      "entity_mapping_supported": false,
      "geographic_mapping_supported": false,
      "reliability_policy_defined": false,
      "manipulation_controls_defined": false,
      "deduplication_supported": false,
      "service_level_defined": false,
      "certification_required": true,
      "certification_identifier": null,
      "domains": [
        "current_events_news",
        "geopolitical_security",
        "government_policy_regulation",
        "central_bank_communications",
        "elections_political_risk",
        "legal_litigation_sanctions",
        "public_health",
        "cybersecurity_incidents",
        "credit_ratings_defaults",
        "supply_chain_shipping_inventories",
        "social_search_sentiment"
      ],
      "authoritative_domains": [],
      "credential_environment_variables": [
        "CAPITAL_INTELLIGENCE_GLOBAL_NEWS_PROVIDER",
        "CAPITAL_INTELLIGENCE_GLOBAL_NEWS_API_KEY"
      ],
      "limitations": [
        "Must retain original publication timestamps, updates, corrections, source attribution, topic/entity tags, and archive rights."
      ]
    },
    {
      "identifier": "commercial-independent-journalism",
      "source_name": "UNASSIGNED_INDEPENDENT_GLOBAL_JOURNALISM_SOURCE",
      "role": "secondary",
      "independence_group": "independent-journalism",
      "enabled": false,
      "usage_rights_approved": false,
      "storage_and_backup_approved": false,
      "derived_analytics_approved": false,
      "internal_display_approved": false,
      "paper_simulation_approved": false,
      "event_time_supported": false,
      "publication_time_supported": false,
      "availability_time_supported": false,
      "correction_history_supported": false,
      "historical_coverage_supported": false,
      "provenance_complete": false,
      "entity_mapping_supported": false,
      "geographic_mapping_supported": false,
      "reliability_policy_defined": false,
      "manipulation_controls_defined": false,
      "deduplication_supported": false,
      "service_level_defined": false,
      "certification_required": true,
      "certification_identifier": null,
      "domains": [
        "current_events_news",
        "geopolitical_security",
        "elections_political_risk",
        "cybersecurity_incidents"
      ],
      "authoritative_domains": [],
      "credential_environment_variables": [
        "CAPITAL_INTELLIGENCE_JOURNALISM_PROVIDER",
        "CAPITAL_INTELLIGENCE_JOURNALISM_API_KEY"
      ],
      "limitations": [
        "Must be contractually and editorially independent from the primary newswire and preserve correction history."
      ]
    },
    {
      "identifier": "issuer-relations-disclosures",
      "source_name": "UNASSIGNED_GLOBAL_ISSUER_RELATIONS_SOURCE",
      "role": "primary",
      "independence_group": "issuer-primary-disclosures",
      "enabled": false,
      "usage_rights_approved": false,
      "storage_and_backup_approved": false,
      "derived_analytics_approved": false,
      "internal_display_approved": false,
      "paper_simulation_approved": false,
      "event_time_supported": false,
      "publication_time_supported": false,
      "availability_time_supported": false,
      "correction_history_supported": false,
      "historical_coverage_supported": false,
      "provenance_complete": false,
      "entity_mapping_supported": false,
      "geographic_mapping_supported": false,
      "reliability_policy_defined": false,
      "manipulation_controls_defined": false,
      "deduplication_supported": false,
      "service_level_defined": false,
      "certification_required": true,
      "certification_identifier": null,
      "domains": [
        "filings_corporate_disclosures",
        "earnings_call_transcripts",
        "management_guidance"
      ],
      "authoritative_domains": [
        "filings_corporate_disclosures",
        "earnings_call_transcripts",
        "management_guidance"
      ],
      "credential_environment_variables": [
        "CAPITAL_INTELLIGENCE_ISSUER_DISCLOSURE_PROVIDER",
        "CAPITAL_INTELLIGENCE_ISSUER_DISCLOSURE_API_KEY"
      ],
      "limitations": [
        "Must preserve the issuer publication time and distinguish prepared remarks, Q&A, presentations, and later corrections."
      ]
    },
    {
      "identifier": "commercial-transcripts-estimates",
      "source_name": "UNASSIGNED_TRANSCRIPTS_ESTIMATES_PROVIDER",
      "role": "primary",
      "independence_group": "transcripts-estimates",
      "enabled": false,
      "usage_rights_approved": false,
      "storage_and_backup_approved": false,
      "derived_analytics_approved": false,
      "internal_display_approved": false,
      "paper_simulation_approved": false,
      "event_time_supported": false,
      "publication_time_supported": false,